{
  "$schema": "./evm-conformance-v1.schema.json",
  "schemaVersion": 1,
  "registryVersion": "1.0.0-local.3",
  "status": "local-development-contract",
  "ownerIssue": 107,
  "baseline": {
    "path": "../poc/upstream-baseline/support-matrix.json",
    "schemaVersion": 1,
    "cosmosEvmRelease": "v0.7.0",
    "cosmosEvmCommit": "f4ab9a3e3fbe353468327d5cacda94b33b41ed11",
    "allowedStates": ["supported", "partial", "stub", "unsupported"]
  },
  "statePolicy": {
    "unknownState": "reject",
    "regression": "reject",
    "upgrade": "require-state-change-evidence",
    "maturityOrder": ["unsupported", "stub", "partial", "supported"]
  },
  "evidenceCatalog": [
    {
      "id": "EVD-BASELINE-MATRIX",
      "kind": "baseline",
      "path": "../poc/upstream-baseline/support-matrix.json",
      "ownerIssues": [89, 107],
      "description": "Versioned Cosmos EVM v0.7.0 capability states and downstream constraints produced by the upstream decision spike."
    },
    {
      "id": "EVD-RPC-COMPATIBILITY",
      "kind": "proof",
      "path": "../poc/upstream-baseline/proof/rpc-compatibility.json",
      "ownerIssues": [89, 107],
      "description": "Signed transfer, clients, fee history, block tags, debug traces, and WebSocket proof from the pinned upstream baseline."
    },
    {
      "id": "EVD-FEE-HISTORY-SATURATION",
      "kind": "proof",
      "path": "../poc/upstream-baseline/proof/fee-history-saturation.json",
      "ownerIssues": [89, 107],
      "description": "Bounded-block-gas proof that records a fully saturated block and its eth_feeHistory response."
    },
    {
      "id": "EVD-WEBSOCKET-RESILIENCE",
      "kind": "proof",
      "path": "../poc/upstream-baseline/proof/websocket-resilience.json",
      "ownerIssues": [89, 107, 131],
      "description": "Socket disconnect, explicit reconnect, new subscription, and HTTP backfill proof."
    },
    {
      "id": "EVD-MEMPOOL",
      "kind": "proof",
      "path": "../poc/upstream-baseline/proof/mempool.json",
      "ownerIssues": [89, 107, 132],
      "description": "Receiving-node fee bump, nonce gap, peer observation, and account queue retention proof."
    },
    {
      "id": "EVD-HARDHAT",
      "kind": "proof",
      "path": "../poc/upstream-baseline/proof/hardhat.json",
      "ownerIssues": [89, 107],
      "description": "Pinned Hardhat and Solidity Prague compilation and provider proof."
    },
    {
      "id": "EVD-FOUNDRY",
      "kind": "proof",
      "path": "../poc/upstream-baseline/proof/foundry.json",
      "ownerIssues": [89, 107],
      "description": "Pinned Foundry chain discovery and signed transaction proof."
    },
    {
      "id": "EVD-METAMASK",
      "kind": "proof",
      "path": "../poc/upstream-baseline/proof/metamask.json",
      "ownerIssues": [89, 107, 132],
      "description": "Pinned MetaMask custom-network import and approved transaction proof from a disposable profile."
    },
    {
      "id": "EVD-BLOCKSCOUT",
      "kind": "proof",
      "path": "../poc/upstream-baseline/proof/blockscout.json",
      "ownerIssues": [89, 112],
      "description": "Pinned Blockscout base indexing and incompatible internal-transaction trace-envelope proof."
    },
    {
      "id": "EVD-PROTOCOL-CONTRACT",
      "kind": "protocol-contract",
      "path": "../config/protocol-v1.json",
      "ownerIssues": [86, 107, 131],
      "description": "Canonical Torium identifiers, transaction envelopes, finality semantics, active precompiles, and explicit bridge exclusions."
    },
    {
      "id": "EVD-TORIUM-TOOLING",
      "kind": "proof",
      "path": "../tests/tooling/proof/tooling-conformance.json",
      "ownerIssues": [107, 131, 132],
      "description": "Canonical four-validator proof for viem, ethers, Hardhat, Foundry, OpenZeppelin ERC-20/ERC-721 execution, and the observed contract-call gas-estimation difference."
    },
    {
      "id": "EVD-TORIUM-STATE-SUBSET",
      "kind": "proof",
      "path": "../tests/state-conformance/proof/state-conformance.json",
      "ownerIssues": [107],
      "description": "Byte-pinned 13-fixture, 64-case Cancun and Prague state-test selection executed against the exact Cosmos go-ethereum replacement with zero runtime skips."
    },
    {
      "id": "EVD-TORIUM-RPC",
      "kind": "proof",
      "path": "../tests/rpc/proof/rpc-conformance.json",
      "ownerIssues": [96, 107, 112, 114, 131, 132],
      "description": "Canonical localnet proof for per-method block tags, JSON-RPC errors and batch limits, WebSocket origins/subscriptions/reconnect/backfill, and the default profile's disabled debug surface."
    },
    {
      "id": "EVD-TORIUM-FEES",
      "kind": "proof",
      "path": "../tests/fees/proof/fee-conformance.json",
      "ownerIssues": [91, 107, 131, 132],
      "description": "Canonical localnet proof for transaction types 0/1/2, wrong-chain and unprotected-signature rejection, fee-history boundaries and saturation, receiving-node replacement, nonce gaps, resource limits, and fee accounting."
    }
  ],
  "capabilities": [
    {
      "id": "chain.four-validator-localnet",
      "baselineState": "supported",
      "targetState": "supported",
      "lane": "required-live",
      "constraintAcknowledged": false,
      "deviationIds": [],
      "skipIds": [],
      "evidenceIds": ["EVD-BASELINE-MATRIX"],
      "downstreamIssues": [107],
      "downstreamImpact": "Conformance claims require a real multi-validator chain rather than a single-process EVM simulation.",
      "sdkBehavior": "standard"
    },
    {
      "id": "evm.state-test-curated-subset",
      "baselineState": "supported",
      "targetState": "supported",
      "lane": "required-static",
      "constraintAcknowledged": false,
      "deviationIds": [],
      "skipIds": [],
      "evidenceIds": ["EVD-TORIUM-STATE-SUBSET"],
      "downstreamIssues": [107],
      "downstreamImpact": "Selected opcode, precompile, state-root, log-root, rollback, transient-state, and creation behavior is continuously checked against pinned upstream vectors.",
      "sdkBehavior": "standard"
    },
    {
      "id": "evm.transaction-envelopes-type-0-1-2",
      "baselineState": "supported",
      "targetState": "supported",
      "lane": "required-live",
      "constraintAcknowledged": false,
      "deviationIds": [],
      "skipIds": [],
      "evidenceIds": ["EVD-TORIUM-FEES"],
      "downstreamIssues": [107, 131, 132],
      "downstreamImpact": "Wallet and SDK transaction builders may emit the three tested standard envelopes and must preserve their receipt type.",
      "sdkBehavior": "standard"
    },
    {
      "id": "evm.transaction-envelopes-type-3-4",
      "baselineState": "unsupported",
      "targetState": "unsupported",
      "lane": "required-live",
      "constraintAcknowledged": true,
      "deviationIds": ["DEV-014"],
      "skipIds": [],
      "evidenceIds": ["EVD-TORIUM-FEES", "EVD-PROTOCOL-CONTRACT"],
      "downstreamIssues": [107, 131, 132],
      "downstreamImpact": "SDK and wallet builders must reject type 3 and type 4 before submission and must never silently translate them to another envelope.",
      "sdkBehavior": "reject"
    },
    {
      "id": "evm.chain-id-replay-protection",
      "baselineState": "supported",
      "targetState": "supported",
      "lane": "required-live",
      "constraintAcknowledged": false,
      "deviationIds": [],
      "skipIds": [],
      "evidenceIds": ["EVD-TORIUM-FEES", "EVD-PROTOCOL-CONTRACT"],
      "downstreamIssues": [107, 131, 132],
      "downstreamImpact": "Clients must sign for the exact Torium replay domain; the endpoint rejects another EIP-155 chain ID and unprotected legacy signatures.",
      "sdkBehavior": "standard"
    },
    {
      "id": "rpc.signed-evm-transfer",
      "baselineState": "supported",
      "targetState": "supported",
      "lane": "required-live",
      "constraintAcknowledged": false,
      "deviationIds": [],
      "skipIds": [],
      "evidenceIds": ["EVD-RPC-COMPATIBILITY", "EVD-TORIUM-TOOLING"],
      "downstreamIssues": [107, 132],
      "downstreamImpact": "Wallet and SDK send flows may rely on standard locally signed EVM transactions only while the chain ID and receipt are verified.",
      "sdkBehavior": "standard"
    },
    {
      "id": "rpc.eth-fee-history",
      "baselineState": "partial",
      "targetState": "partial",
      "lane": "required-live",
      "constraintAcknowledged": true,
      "deviationIds": ["DEV-001"],
      "skipIds": [],
      "evidenceIds": [
        "EVD-RPC-COMPATIBILITY",
        "EVD-FEE-HISTORY-SATURATION",
        "EVD-TORIUM-FEES"
      ],
      "downstreamIssues": [107, 132],
      "downstreamImpact": "Fee estimation must preserve and surface the non-geth 100-block request cap while consuming canonical saturated-block data.",
      "sdkBehavior": "capability-detect"
    },
    {
      "id": "rpc.eth-estimate-gas-contract-execution",
      "baselineState": "partial",
      "targetState": "partial",
      "lane": "required-live",
      "constraintAcknowledged": true,
      "deviationIds": ["DEV-012"],
      "skipIds": [],
      "evidenceIds": ["EVD-TORIUM-TOOLING"],
      "downstreamIssues": [107, 131, 132],
      "downstreamImpact": "Contract writes require a visible, configurable gas margin until estimated gas matches committed Cosmos EVM execution.",
      "sdkBehavior": "capability-detect"
    },
    {
      "id": "rpc.block-tag-latest",
      "baselineState": "supported",
      "targetState": "supported",
      "lane": "required-live",
      "constraintAcknowledged": false,
      "deviationIds": [],
      "skipIds": [],
      "evidenceIds": ["EVD-RPC-COMPATIBILITY", "EVD-TORIUM-RPC"],
      "downstreamIssues": [107, 131],
      "downstreamImpact": "Standard latest-state block and account queries are available to clients.",
      "sdkBehavior": "standard"
    },
    {
      "id": "rpc.block-tag-pending",
      "baselineState": "partial",
      "targetState": "partial",